{
  "schemaVersion": "1.0.0",
  "frameworkId": "ncom",
  "familyId": "family-slot-reference-b8102051",
  "familyName": "Reference-anchored popup components",
  "decision": "approved",
  "reviewer": "codex-assisted-manual-review",
  "reviewMethod": "explicit-cli-review",
  "sourceCommit": "a350b576bbeae6c6254273037a17d2a8730fb80f",
  "structuralSignal": "slot:reference",
  "candidateComponentIds": [
    "component-1211c985a80a45a7",
    "component-baf8eef39d4e3bee"
  ],
  "approvedComponentIds": [
    "component-1211c985a80a45a7",
    "component-baf8eef39d4e3bee"
  ],
  "excludedComponentIds": [],
  "evidence": [
    {
      "componentId": "component-baf8eef39d4e3bee",
      "path": "packages/components/src/popmenu/index.ts",
      "line": 41,
      "sha256": "c1d3870ac0f834a702c2b1d584c4231e63e20b9ad3c2fee97594133adc47246b"
    },
    {
      "componentId": "component-1211c985a80a45a7",
      "path": "packages/components/src/popover/index.ts",
      "line": 5,
      "sha256": "087686f36f1df42d123ba73c542c551d8923d91bffc1e8bbb9a079f90b0b10a9"
    }
  ],
  "limitations": [
    "候选只表示共享结构信号，不自动证明组件具有相同语义或行为。",
    "发布家族知识前必须显式复核成员范围。",
    "共享 reference slot 不证明定位和触发策略相同。"
  ],
  "reviewedAt": "2026-07-27T06:28:47.451Z"
}
